{
  "$schema": "https://json-schema.org/draft/2020-12/schema",
  "$id": "keryx/shared-agent-context/workspace-manifest/v1",
  "$vocabulary": {"https://json-schema.org/draft/2020-12/vocab/format-assertion": true},
  "type": "object",
  "additionalProperties": false,
  "required": ["schemaVersion", "id", "title", "status", "members", "resources", "createdAt", "updatedAt"],
  "properties": {
    "schemaVersion": {"const": "1.0"},
    "id": {"type": "string", "pattern": "^[a-z][a-z0-9-]{2,63}$"},
    "title": {"type": "string", "minLength": 1, "maxLength": 160},
    "status": {"enum": ["active", "archived"]},
    "members": {
      "type": "array",
      "minItems": 1,
      "uniqueItems": true,
      "items": {"$ref": "#/$defs/member"},
      "contains": {"properties": {"role": {"const": "owner"}}, "required": ["role"]},
      "minContains": 1,
      "maxContains": 1,
      "x-uniqueBy": "subject",
      "x-roleTopology": "exactly-one-owner; each canonical subject has one role"
    },
    "resources": {"type": "array", "items": {"$ref": "#/$defs/resourceRef"}, "x-uniqueBy": "uri"},
    "createdAt": {"$ref": "#/$defs/utcTimestamp"},
    "updatedAt": {"$ref": "#/$defs/utcTimestamp"}
  },
  "x-temporalOrder": [{"earlier": "createdAt", "laterOrEqual": "updatedAt"}],
  "x-rootContainment": {"fields": ["resources[].uri"], "root": "workspace root", "resolveSymlinks": true, "rejectEscapes": true},
  "$defs": {
    "utcTimestamp": {"type": "string", "format": "date-time", "pattern": "^[0-9]{4}-[0-9]{2}-[0-9]{2}T[0-9]{2}:[0-9]{2}:[0-9]{2}(?:\\.[0-9]+)?Z$", "x-formatAssertionRequired": true},
    "subjectId": {"type": "string", "pattern": "^(?:user|team|service|agent):[a-z0-9][a-z0-9._-]{0,127}$"},
    "member": {"type": "object", "additionalProperties": false, "required": ["subject", "role"], "properties": {"subject": {"$ref": "#/$defs/subjectId"}, "role": {"enum": ["owner", "editor", "viewer"]}}},
    "workspacePath": {"type": "string", "pattern": "^\\./(?!.*(?:^|/)\\.\\.(?:/|$))(?:[A-Za-z0-9._-]+/)*[A-Za-z0-9._-]+$", "x-canonicalize": "realpath within workspace root"},
    "resourceRef": {"type": "object", "additionalProperties": false, "required": ["kind", "uri"], "properties": {"kind": {"enum": ["component", "repository", "flow", "wiki", "memory", "skill", "evidence", "worktree"]}, "uri": {"$ref": "#/$defs/workspacePath"}, "revision": {"type": "string", "minLength": 1, "maxLength": 256}}}
  }
}
